{
  "activation_mem_bound_bytes": 67108864,
  "atlas_provenance": {
    "island": "gemma4_dense_ffn_blk2",
    "n_embd": 3840,
    "n_ff": 15360,
    "op12_e2e_us_measured": 45002,
    "op15_e2e_us_measured": 27142,
    "thermal_multiplier": 1.0,
    "weight_bytes_f16": 353925120
  },
  "cp1_params": {
    "per_wave": 9,
    "phone_resident": [
      "w0"
    ],
    "slack_us": 90000,
    "thermal": "warm",
    "wave_spacing_us": 8000,
    "waves": 2,
    "weight_mix": [
      [
        "w0",
        "m0"
      ]
    ]
  },
  "horizon_us": 200000,
  "instance_id": "sweep_favorable_batchable_load9_slack",
  "instance_version": 1,
  "lffn_us_table": {
    "0": 0,
    "1": 517,
    "10": 535,
    "100": 663,
    "1000": 3541,
    "1001": 3545,
    "1002": 3548,
    "1003": 3552,
    "1004": 3555,
    "1005": 3559,
    "1006": 3562,
    "1007": 3566,
    "1008": 3569,
    "1009": 3573,
    "101": 664,
    "1010": 3576,
    "1011": 3580,
    "1012": 3583,
    "1013": 3587,
    "1014": 3590,
    "1015": 3594,
    "1016": 3597,
    "1017": 3601,
    "1018": 3604,
    "1019": 3608,
    "102": 665,
    "1020": 3611,
    "1021": 3615,
    "1022": 3618,
    "1023": 3622,
    "1024": 3625,
    "1025": 3628,
    "1026": 3632,
    "1027": 3635,
    "1028": 3639,
    "1029": 3642,
    "103": 667,
    "1030": 3646,
    "1031": 3649,
    "1032": 3653,
    "1033": 3656,
    "1034": 3660,
    "1035": 3663,
    "1036": 3667,
    "1037": 3670,
    "1038": 3674,
    "1039": 3677,
    "104": 668,
    "1040": 3681,
    "1041": 3684,
    "1042": 3688,
    "1043": 3691,
    "1044": 3695,
    "1045": 3698,
    "1046": 3702,
    "1047": 3705,
    "1048": 3709,
    "1049": 3712,
    "105": 669,
    "1050": 3716,
    "1051": 3719,
    "1052": 3723,
    "1053": 3726,
    "1054": 3729,
    "1055": 3733,
    "1056": 3736,
    "1057": 3740,
    "1058": 3743,
    "1059": 3747,
    "106": 671,
    "1060": 3750,
    "1061": 3754,
    "1062": 3757,
    "1063": 3761,
    "1064": 3764,
    "1065": 3768,
    "1066": 3771,
    "1067": 3775,
    "1068": 3778,
    "1069": 3782,
    "107": 672,
    "1070": 3785,
    "1071": 3789,
    "1072": 3792,
    "1073": 3796,
    "1074": 3799,
    "1075": 3803,
    "1076": 3806,
    "1077": 3810,
    "1078": 3813,
    "1079": 3817,
    "108": 673,
    "1080": 3820,
    "1081": 3823,
    "1082": 3827,
    "1083": 3830,
    "1084": 3834,
    "1085": 3837,
    "1086": 3841,
    "1087": 3844,
    "1088": 3848,
    "1089": 3851,
    "109": 675,
    "1090": 3855,
    "1091": 3858,
    "1092": 3862,
    "1093": 3865,
    "1094": 3869,
    "1095": 3872,
    "1096": 3876,
    "1097": 3879,
    "1098": 3883,
    "1099": 3886,
    "11": 537,
    "110": 676,
    "1100": 3890,
    "1101": 3893,
    "1102": 3897,
    "1103": 3900,
    "1104": 3904,
    "1105": 3907,
    "1106": 3911,
    "1107": 3914,
    "1108": 3918,
    "1109": 3921,
    "111": 677,
    "1110": 3924,
    "1111": 3928,
    "1112": 3931,
    "1113": 3935,
    "1114": 3938,
    "1115": 3942,
    "1116": 3945,
    "1117": 3949,
    "1118": 3952,
    "1119": 3956,
    "112": 679,
    "1120": 3959,
    "1121": 3963,
    "1122": 3966,
    "1123": 3970,
    "1124": 3973,
    "1125": 3977,
    "1126": 3980,
    "1127": 3984,
    "1128": 3987,
    "1129": 3991,
    "113": 680,
    "1130": 3994,
    "1131": 3998,
    "1132": 4001,
    "1133": 4005,
    "1134": 4008,
    "1135": 4012,
    "1136": 4015,
    "1137": 4019,
    "1138": 4022,
    "1139": 4025,
    "114": 681,
    "1140": 4029,
    "1141": 4032,
    "1142": 4036,
    "1143": 4039,
    "1144": 4043,
    "1145": 4046,
    "1146": 4050,
    "1147": 4053,
    "1148": 4057,
    "1149": 4060,
    "115": 683,
    "1150": 4064,
    "1151": 4067,
    "1152": 4071,
    "1153": 4074,
    "1154": 4078,
    "1155": 4081,
    "1156": 4085,
    "1157": 4088,
    "1158": 4092,
    "1159": 4095,
    "116": 684,
    "1160": 4099,
    "1161": 4102,
    "1162": 4106,
    "1163": 4109,
    "1164": 4113,
    "1165": 4116,
    "1166": 4120,
    "1167": 4123,
    "1168": 4126,
    "1169": 4130,
    "117": 685,
    "1170": 4133,
    "1171": 4137,
    "1172": 4140,
    "1173": 4144,
    "1174": 4147,
    "1175": 4151,
    "1176": 4154,
    "1177": 4158,
    "1178": 4161,
    "1179": 4165,
    "118": 687,
    "1180": 4168,
    "1181": 4172,
    "1182": 4175,
    "1183": 4179,
    "1184": 4182,
    "1185": 4186,
    "1186": 4189,
    "1187": 4193,
    "1188": 4196,
    "1189": 4200,
    "119": 688,
    "1190": 4203,
    "1191": 4207,
    "1192": 4210,
    "1193": 4214,
    "1194": 4217,
    "1195": 4220,
    "1196": 4224,
    "1197": 4227,
    "1198": 4231,
    "1199": 4234,
    "12": 538,
    "120": 689,
    "1200": 4238,
    "1201": 4241,
    "1202": 4245,
    "1203": 4248,
    "1204": 4252,
    "1205": 4255,
    "1206": 4259,
    "1207": 4262,
    "1208": 4266,
    "1209": 4269,
    "121": 691,
    "1210": 4273,
    "1211": 4276,
    "1212": 4280,
    "1213": 4283,
    "1214": 4287,
    "1215": 4290,
    "1216": 4294,
    "1217": 4297,
    "1218": 4301,
    "1219": 4304,
    "122": 692,
    "1220": 4308,
    "1221": 4311,
    "1222": 4315,
    "1223": 4318,
    "1224": 4321,
    "1225": 4325,
    "1226": 4328,
    "1227": 4332,
    "1228": 4335,
    "1229": 4339,
    "123": 693,
    "1230": 4342,
    "1231": 4346,
    "1232": 4349,
    "1233": 4353,
    "1234": 4356,
    "1235": 4360,
    "1236": 4363,
    "1237": 4367,
    "1238": 4370,
    "1239": 4374,
    "124": 695,
    "1240": 4377,
    "1241": 4381,
    "1242": 4384,
    "1243": 4388,
    "1244": 4391,
    "1245": 4395,
    "1246": 4398,
    "1247": 4402,
    "1248": 4405,
    "1249": 4409,
    "125": 696,
    "1250": 4412,
    "1251": 4416,
    "1252": 4419,
    "1253": 4422,
    "1254": 4426,
    "1255": 4429,
    "1256": 4433,
    "1257": 4436,
    "1258": 4440,
    "1259": 4443,
    "126": 697,
    "1260": 4447,
    "1261": 4450,
    "1262": 4454,
    "1263": 4457,
    "1264": 4461,
    "1265": 4464,
    "1266": 4468,
    "1267": 4471,
    "1268": 4475,
    "1269": 4478,
    "127": 699,
    "1270": 4482,
    "1271": 4485,
    "1272": 4489,
    "1273": 4492,
    "1274": 4496,
    "1275": 4499,
    "1276": 4503,
    "1277": 4506,
    "1278": 4510,
    "1279": 4513,
    "128": 700,
    "1280": 4516,
    "1281": 4520,
    "1282": 4523,
    "1283": 4527,
    "1284": 4530,
    "1285": 4534,
    "1286": 4537,
    "1287": 4541,
    "1288": 4544,
    "1289": 4548,
    "129": 702,
    "1290": 4551,
    "1291": 4555,
    "1292": 4558,
    "1293": 4562,
    "1294": 4565,
    "1295": 4569,
    "1296": 4572,
    "1297": 4576,
    "1298": 4579,
    "1299": 4583,
    "13": 540,
    "130": 705,
    "1300": 4586,
    "1301": 4590,
    "1302": 4593,
    "1303": 4597,
    "1304": 4600,
    "1305": 4604,
    "1306": 4607,
    "1307": 4611,
    "1308": 4614,
    "1309": 4617,
    "131": 707,
    "1310": 4621,
    "1311": 4624,
    "1312": 4628,
    "1313": 4631,
    "1314": 4635,
    "1315": 4638,
    "1316": 4642,
    "1317": 4645,
    "1318": 4649,
    "1319": 4652,
    "132": 709,
    "1320": 4656,
    "1321": 4659,
    "1322": 4663,
    "1323": 4666,
    "1324": 4670,
    "1325": 4673,
    "1326": 4677,
    "1327": 4680,
    "1328": 4684,
    "1329": 4687,
    "133": 712,
    "1330": 4691,
    "1331": 4694,
    "1332": 4698,
    "1333": 4701,
    "1334": 4705,
    "1335": 4708,
    "1336": 4712,
    "1337": 4715,
    "1338": 4718,
    "1339": 4722,
    "134": 714,
    "1340": 4725,
    "1341": 4729,
    "1342": 4732,
    "1343": 4736,
    "1344": 4739,
    "1345": 4743,
    "1346": 4746,
    "1347": 4750,
    "1348": 4753,
    "1349": 4757,
    "135": 716,
    "1350": 4760,
    "1351": 4764,
    "1352": 4767,
    "1353": 4771,
    "1354": 4774,
    "1355": 4778,
    "1356": 4781,
    "1357": 4785,
    "1358": 4788,
    "1359": 4792,
    "136": 719,
    "1360": 4795,
    "1361": 4799,
    "1362": 4802,
    "1363": 4806,
    "1364": 4809,
    "1365": 4813,
    "1366": 4816,
    "1367": 4819,
    "1368": 4823,
    "1369": 4826,
    "137": 721,
    "1370": 4830,
    "1371": 4833,
    "1372": 4837,
    "1373": 4840,
    "1374": 4844,
    "1375": 4847,
    "1376": 4851,
    "1377": 4854,
    "1378": 4858,
    "1379": 4861,
    "138": 723,
    "1380": 4865,
    "1381": 4868,
    "1382": 4872,
    "1383": 4875,
    "1384": 4879,
    "1385": 4882,
    "1386": 4886,
    "1387": 4889,
    "1388": 4893,
    "1389": 4896,
    "139": 726,
    "1390": 4900,
    "1391": 4903,
    "1392": 4907,
    "1393": 4910,
    "1394": 4913,
    "1395": 4917,
    "1396": 4920,
    "1397": 4924,
    "1398": 4927,
    "1399": 4931,
    "14": 542,
    "140": 728,
    "1400": 4934,
    "1401": 4938,
    "1402": 4941,
    "1403": 4945,
    "1404": 4948,
    "1405": 4952,
    "1406": 4955,
    "1407": 4959,
    "1408": 4962,
    "1409": 4966,
    "141": 730,
    "1410": 4969,
    "1411": 4973,
    "1412": 4976,
    "1413": 4980,
    "1414": 4983,
    "1415": 4987,
    "1416": 4990,
    "1417": 4994,
    "1418": 4997,
    "1419": 5001,
    "142": 733,
    "1420": 5004,
    "1421": 5008,
    "1422": 5011,
    "1423": 5014,
    "1424": 5018,
    "1425": 5021,
    "1426": 5025,
    "1427": 5028,
    "1428": 5032,
    "1429": 5035,
    "143": 735,
    "1430": 5039,
    "1431": 5042,
    "1432": 5046,
    "1433": 5049,
    "1434": 5053,
    "1435": 5056,
    "1436": 5060,
    "1437": 5063,
    "1438": 5067,
    "1439": 5070,
    "144": 737,
    "1440": 5074,
    "1441": 5077,
    "1442": 5081,
    "1443": 5084,
    "1444": 5088,
    "1445": 5091,
    "1446": 5095,
    "1447": 5098,
    "1448": 5102,
    "1449": 5105,
    "145": 740,
    "1450": 5109,
    "1451": 5112,
    "1452": 5115,
    "1453": 5119,
    "1454": 5122,
    "1455": 5126,
    "1456": 5129,
    "1457": 5133,
    "1458": 5136,
    "1459": 5140,
    "146": 742,
    "1460": 5143,
    "1461": 5147,
    "1462": 5150,
    "1463": 5154,
    "1464": 5157,
    "1465": 5161,
    "1466": 5164,
    "1467": 5168,
    "1468": 5171,
    "1469": 5175,
    "147": 744,